{"benchmark_schema":"grid.feature-benchmark/v1","command":"'benchmarks\\feature_benchmark.py' --profile scaled --rows 10000000 --instruments 700 --core-minutes 2880 --window-minutes 1440 --output 'benchmarks\\results\\m1-feature-scaled.json' --force","correctness":{"core_rows_written_once":true,"future_rows_read":0,"halo_minutes":1440,"semantics":"rolling window uses only the current and prior closed rows"},"hardware":{"cpu_count_logical":12,"cpu_count_physical":6,"machine":"AMD64","platform":"Windows-10-10.0.19044-SP0","ram_bytes":16476225536},"input":{"core_minutes_per_shard":2880,"feature_columns":["rolling_mid","rolling_high","rolling_low","rolling_atr","rolling_volume_mean","range_width","range_position","lower_touch","upper_touch","mid_crossing"],"instrument_count":700,"row_count":9999500,"synthetic_generator":"deterministic-range-v1","window_minutes":1440},"limitations":["Synthetic input is not evidence of production market-data compression or skew.","The benchmark materializes and aggregates features but does not publish a feature dataset.","A scaled or smoke run does not close the full-scale feature-memory gate."],"memory_gate":{"configured_limit_percent":70,"passed":true,"peak_rss_percent_of_ram":"8.938957608"},"profile":"scaled","result":{"aggregate_sums":{"range_position":"6745793.793409952","range_width":"2257850.152800000","rolling_atr":"140926.704729236","rolling_high":"1215453849.435500145","rolling_low":"1213195999.282700062","rolling_mid":"1214324939.240023136","rolling_volume_mean":"944175060.044444442"},"elapsed_seconds":"2.930438400","input_rows_including_halos":14031500,"maximum_shard_input_rows":3024000,"output_rows":9999500,"peak_rss_bytes":1472802816,"rss_baseline_bytes":47546368,"rss_peak_delta_bytes":1425256448,"shards":[{"core_end_minute_exclusive":2880,"core_start_minute":0,"elapsed_seconds":"0.477079800","halo_start_minute":0,"input_rows":2016000,"output_rows":2016000},{"core_end_minute_exclusive":5760,"core_start_minute":2880,"elapsed_seconds":"0.654338600","halo_start_minute":1440,"input_rows":3024000,"output_rows":2016000},{"core_end_minute_exclusive":8640,"core_start_minute":5760,"elapsed_seconds":"0.604219300","halo_start_minute":4320,"input_rows":3024000,"output_rows":2016000},{"core_end_minute_exclusive":11520,"core_start_minute":8640,"elapsed_seconds":"0.636939600","halo_start_minute":7200,"input_rows":3024000,"output_rows":2016000},{"core_end_minute_exclusive":14285,"core_start_minute":11520,"elapsed_seconds":"0.557179300","halo_start_minute":10080,"input_rows":2943500,"output_rows":1935500}],"throughput_core_rows_per_second":"3412288.072664424","warmup_null_rows":1007300},"software":{"polars":"1.43.2","psutil":"7.2.2","python":"3.14.0"},"status":"scaled-only"}
